results_v3/statistics/effect_sizes_robustness.csv

stage,condition,metric,comparison,effect_size_name,effect_size,mean_diff,ci95_low,ci95_high,n_pairs
robustness,N16,SR,muzero_vs_sequential,cohens_dz,-0.5486714768543043,-0.2152,-0.2495796105375472,-0.1808203894624528,500
robustness,N16,SR,muzero_vs_random,cohens_dz,0.03135263349122588,0.010399999999999998,-0.01867571363414266,0.03947571363414266,500
robustness,N16,SR,muzero_vs_dqn,cohens_dz,1.0513959723786948,0.3568,0.3270539292968541,0.3865460707031459,500
robustness,N16,SR,muzero_vs_ppo,cohens_dz,1.080743457683659,0.3836,0.3524880628730453,0.4147119371269547,500
robustness,N24,SR,muzero_vs_sequential,cohens_dz,-0.7901755867833934,-0.4328,-0.4808103324937907,-0.38478966750620935,500
robustness,N24,SR,muzero_vs_random,cohens_dz,-0.5802246665431985,-0.238,-0.2739543828551261,-0.2020456171448739,500
robustness,N24,SR,muzero_vs_dqn,cohens_dz,0.42174516263427486,0.16160000000000002,0.12801368818565248,0.19518631181434756,500
robustness,N24,SR,muzero_vs_ppo,cohens_dz,0.2688623048529643,0.118,0.07952991382566812,0.15647008617433186,500
robustness,N32,SR,muzero_vs_sequential,cohens_dz,-0.44075605168700077,-0.21280000000000002,-0.25511987817432114,-0.17048012182567893,500
robustness,N32,SR,muzero_vs_random,cohens_dz,-0.346832502300094,-0.102,-0.12777813250471923,-0.07622186749528077,500
robustness,N32,SR,muzero_vs_dqn,cohens_dz,0.6473421881807178,0.14959999999999998,0.12934329743799916,0.1698567025620008,500
robustness,N32,SR,muzero_vs_ppo,cohens_dz,0.7928469841602134,0.2004,0.178244609564743,0.222555390435257,500
robustness,N48,SR,muzero_vs_sequential,cohens_dz,-0.3880011773503906,-0.1776,-0.21772185344442144,-0.13747814655557858,500
robustness,N48,SR,muzero_vs_random,cohens_dz,-0.2940431750224079,-0.1024,-0.13292529869614675,-0.07187470130385326,500
robustness,N48,SR,muzero_vs_dqn,cohens_dz,0.4366422051065156,0.1448,0.11573208246310268,0.17386791753689734,500
robustness,N48,SR,muzero_vs_ppo,cohens_dz,0.3868021149390188,0.1176,0.09095047019466025,0.14424952980533973,500
robustness,N64,SR,muzero_vs_sequential,cohens_dz,-0.5209688432913273,-0.22519999999999998,-0.26309027038504346,-0.1873097296149565,500
robustness,N64,SR,muzero_vs_random,cohens_dz,-0.56323072625377,-0.15280000000000002,-0.1765797937942657,-0.12902020620573434,500
robustness,N64,SR,muzero_vs_dqn,cohens_dz,0.17604198696386972,0.0384,0.019280081716745837,0.05751991828325416,500
robustness,N64,SR,muzero_vs_ppo,cohens_dz,0.2794430766075867,0.0384,0.026354940784245925,0.05044505921575407,500
robustness,N8,SR,muzero_vs_sequential,cohens_dz,-0.9449364320706943,-0.266,-0.2906745995007223,-0.24132540049927778,500
robustness,N8,SR,muzero_vs_random,cohens_dz,-0.6741506274939579,-0.18880000000000002,-0.21334800008163632,-0.16425199991836373,500
robustness,N8,SR,muzero_vs_dqn,cohens_dz,0.6804718328860594,0.2164,0.18852478840670905,0.24427521159329096,500
robustness,N8,SR,muzero_vs_ppo,cohens_dz,1.0955643131447468,0.2696,0.24802985423636342,0.2911701457636366,500
robustness,pfa_0.01,SR,muzero_vs_sequential,cohens_dz,-0.47563135911647797,-0.1884,-0.22312014154732285,-0.15367985845267718,500
robustness,pfa_0.01,SR,muzero_vs_random,cohens_dz,0.05367913168877176,0.018399999999999996,-0.011645774960782559,0.04844577496078255,500
robustness,pfa_0.01,SR,muzero_vs_dqn,cohens_dz,1.0271109035406192,0.338,0.3091550075337025,0.36684499246629754,500
robustness,pfa_0.01,SR,muzero_vs_ppo,cohens_dz,1.0166072096634409,0.35640000000000005,0.32567049396409997,0.38712950603590013,500
robustness,pfa_0.03,SR,muzero_vs_sequential,cohens_dz,-0.5222890774980863,-0.2072,-0.2419736178144266,-0.17242638218557338,500
robustness,pfa_0.03,SR,muzero_vs_random,cohens_dz,0.059354142144930566,0.0192,-0.009154452474033146,0.04755445247403314,500
robustness,pfa_0.03,SR,muzero_vs_dqn,cohens_dz,1.0333651839969273,0.3436,0.31445457456519893,0.3727454254348011,500
robustness,pfa_0.03,SR,muzero_vs_ppo,cohens_dz,1.0278705912577002,0.36840000000000006,0.33698390147869095,0.39981609852130917,500
robustness,pfa_0.05,SR,muzero_vs_sequential,cohens_dz,-0.4437270578504707,-0.1832,-0.2193893369634165,-0.1470106630365835,500
robustness,pfa_0.05,SR,muzero_vs_random,cohens_dz,0.03633717566170476,0.011599999999999997,-0.016381944447055076,0.03958194444705507,500
robustness,pfa_0.05,SR,muzero_vs_dqn,cohens_dz,1.0532801267944987,0.33920000000000006,0.3109718105981661,0.367428189401834,500
robustness,pfa_0.05,SR,muzero_vs_ppo,cohens_dz,1.098037096210546,0.39,0.35886716545552677,0.42113283454447326,500
robustness,pfa_0.08,SR,muzero_vs_sequential,cohens_dz,-0.42253414903657377,-0.18439999999999998,-0.22265341144816816,-0.1461465885518318,500
robustness,pfa_0.08,SR,muzero_vs_random,cohens_dz,0.011174164480739683,0.0036000000000000008,-0.02463959800562037,0.031839598005620376,500
robustness,pfa_0.08,SR,muzero_vs_dqn,cohens_dz,0.9500706670500327,0.32680000000000003,0.29664931333709815,0.3569506866629019,500
robustness,pfa_0.08,SR,muzero_vs_ppo,cohens_dz,0.9619495851813467,0.35520000000000007,0.32283379991274586,0.3875662000872543,500
robustness,pfa_0.10,SR,muzero_vs_sequential,cohens_dz,-0.58966157281385,-0.2312,-0.2655681434523415,-0.19683185654765853,500
robustness,pfa_0.10,SR,muzero_vs_random,cohens_dz,0.05700398011252365,0.018399999999999996,-0.009893307022200589,0.04669330702220058,500
robustness,pfa_0.10,SR,muzero_vs_dqn,cohens_dz,0.9880706321642385,0.3356,0.3058282042985887,0.3653717957014113,500
robustness,pfa_0.10,SR,muzero_vs_ppo,cohens_dz,0.9772453886858496,0.3564,0.32443276050501296,0.388367239494987,500
robustness,pfa_0.12,SR,muzero_vs_sequential,cohens_dz,-0.5705096836465089,-0.22199999999999998,-0.25610837453804053,-0.18789162546195942,500
robustness,pfa_0.12,SR,muzero_vs_random,cohens_dz,0.011148364774912559,0.0035999999999999995,-0.024704950488781015,0.03190495048878102,500
robustness,pfa_0.12,SR,muzero_vs_dqn,cohens_dz,0.9960058280187587,0.3212,0.2929326740914525,0.34946732590854745,500
robustness,pfa_0.12,SR,muzero_vs_ppo,cohens_dz,1.1253020064416313,0.3836,0.35372000128556985,0.41347999871443014,500
robustness,pfa_0.15,SR,muzero_vs_sequential,cohens_dz,-0.5938316022086122,-0.2264,-0.2598182871008301,-0.1929817128991699,500
robustness,pfa_0.15,SR,muzero_vs_random,cohens_dz,0.0115936239091668,0.0036000000000000025,-0.023617884197129218,0.030817884197129223,500
robustness,pfa_0.15,SR,muzero_vs_dqn,cohens_dz,1.1177429028090617,0.34440000000000004,0.31739200832945647,0.3714079916705436,500
robustness,pfa_0.15,SR,muzero_vs_ppo,cohens_dz,1.1475109853033483,0.4016,0.3709233506941637,0.4322766493058363,500
robustness,snr_+0dB,SR,muzero_vs_sequential,cohens_dz,-0.5099141488314372,-0.2016,-0.23625489076473669,-0.16694510923526332,500
robustness,snr_+0dB,SR,muzero_vs_random,cohens_dz,0.11331379298762835,0.03799999999999999,0.00860510665592714,0.06739489334407284,500
robustness,snr_+0dB,SR,muzero_vs_dqn,cohens_dz,1.1189518395725517,0.3528,0.32516316847709836,0.38043683152290164,500
robustness,snr_+0dB,SR,muzero_vs_ppo,cohens_dz,1.0643221808487089,0.38839999999999997,0.35641272991480816,0.4203872700851918,500
robustness,snr_+10dB,SR,muzero_vs_sequential,cohens_dz,-0.9693433473301056,-0.254,-0.2769682100771544,-0.23103178992284562,500
robustness,snr_+10dB,SR,muzero_vs_random,cohens_dz,0.02718690934459718,0.008799999999999997,-0.01957225812398633,0.03717225812398633,500
robustness,snr_+10dB,SR,muzero_vs_dqn,cohens_dz,1.2023057295230049,0.3768000000000001,0.34932946948955945,0.4042705305104407,500
robustness,snr_+10dB,SR,muzero_vs_ppo,cohens_dz,1.3180460310097923,0.43,0.4014037590934057,0.4585962409065943,500
robustness,snr_+3dB,SR,muzero_vs_sequential,cohens_dz,-0.6627671760884631,-0.23239999999999997,-0.2631359188798183,-0.20166408112018164,500
robustness,snr_+3dB,SR,muzero_vs_random,cohens_dz,0.0728823050558131,0.023599999999999996,-0.004783174842788691,0.05198317484278868,500
robustness,snr_+3dB,SR,muzero_vs_dqn,cohens_dz,1.1695291814686462,0.38920000000000005,0.3600302411869687,0.4183697588130314,500
robustness,snr_+3dB,SR,muzero_vs_ppo,cohens_dz,1.2167699777564676,0.424,0.39345582211934965,0.4545441778806503,500
robustness,snr_+6dB,SR,muzero_vs_sequential,cohens_dz,-0.6752311287740048,-0.23039999999999997,-0.26030894461233367,-0.20049105538766623,500
robustness,snr_+6dB,SR,muzero_vs_random,cohens_dz,0.05223741651178004,0.017599999999999998,-0.01193262473630868,0.04713262473630868,500
robustness,snr_+6dB,SR,muzero_vs_dqn,cohens_dz,1.2093037699642804,0.39840000000000003,0.36952280588964065,0.4272771941103594,500
robustness,snr_+6dB,SR,muzero_vs_ppo,cohens_dz,1.111501029618112,0.4036,0.3717717795508149,0.4354282204491851,500
robustness,snr_-10dB,SR,muzero_vs_sequential,cohens_dz,-0.19137080039566848,-0.0916,-0.133555690165728,-0.049644309834272,500
robustness,snr_-10dB,SR,muzero_vs_random,cohens_dz,0.03963421482117129,0.012400000000000005,-0.015023475585607095,0.0398234755856071,500
robustness,snr_-10dB,SR,muzero_vs_dqn,cohens_dz,0.6005864638183802,0.18680000000000002,0.1595370779800453,0.21406292201995475,500
robustness,snr_-10dB,SR,muzero_vs_ppo,cohens_dz,0.5804261065151178,0.2064,0.17523021374345732,0.23756978625654268,500
robustness,snr_-3dB,SR,muzero_vs_sequential,cohens_dz,-0.5237194891195843,-0.22640000000000002,-0.2642921071001466,-0.18850789289985345,500
robustness,snr_-3dB,SR,muzero_vs_random,cohens_dz,0.004987273205721892,0.001599999999999997,-0.026520814273395386,0.02972081427339538,500
robustness,snr_-3dB,SR,muzero_vs_dqn,cohens_dz,0.9033112272335824,0.2988,0.26980559144167116,0.32779440855832886,500
robustness,snr_-3dB,SR,muzero_vs_ppo,cohens_dz,0.9444274360821157,0.3436,0.31170991848982743,0.3754900815101726,500
robustness,snr_-6dB,SR,muzero_vs_sequential,cohens_dz,-0.37603181790631807,-0.16879999999999998,-0.2081476606495123,-0.12945233935048767,500
robustness,snr_-6dB,SR,muzero_vs_random,cohens_dz,0.01938708711934255,0.006399999999999999,-0.02253599903594857,0.03533599903594857,500
robustness,snr_-6dB,SR,muzero_vs_dqn,cohens_dz,0.8210632511843158,0.26680000000000004,0.23831735743497504,0.295282642565025,500
robustness,snr_-6dB,SR,muzero_vs_ppo,cohens_dz,0.7564349108125388,0.278,0.24578602620888215,0.3102139737911179,500

results_v3/reports/final_experiment_report.md

## 10. Statistical Tests

- easy: muzero(full) vs muzero(main|woMCTS): ΔSR=0.082, p=0.0000, cohens_dz=0.223

- hard: muzero(full) vs muzero(wo_memory|woMemory): ΔSR=0.053, p=0.0000, cohens_dz=0.181

- medium: muzero(full) vs muzero(main|D1): ΔSR=0.129, p=0.0000, cohens_dz=0.366

- easy: muzero vs belief_greedy: ΔSR=-0.274, p=0.0000, cohens_dz=-1.095

- easy: muzero vs dqn_gru: ΔSR=-0.095, p=0.0000, cohens_dz=-0.404

- easy: muzero vs ppo_stack: ΔSR=0.277, p=0.0000, cohens_dz=0.802

- hard: muzero vs belief_greedy: ΔSR=0.278, p=0.0000, cohens_dz=1.398

- hard: muzero vs ppo_stack: ΔSR=0.146, p=0.0000, cohens_dz=0.582

- medium: muzero vs dqn_gru: ΔSR=0.230, p=0.0000, cohens_dz=0.587

- ood_n: muzero vs dqn_gru: ΔSR=0.102, p=0.0000, cohens_dz=0.351

- ood_pfa: muzero vs sequential: ΔSR=-0.226, p=0.0000, cohens_dz=-0.602

- ood_pfa: muzero vs dqn_gru: ΔSR=0.191, p=0.0000, cohens_dz=0.503

- ood_prior: muzero vs sequential: ΔSR=-0.188, p=0.0000, cohens_dz=-0.472

- ood_prior: muzero vs ppo: ΔSR=0.384, p=0.0000, cohens_dz=1.026

- ood_prior: muzero vs ppo_stack: ΔSR=0.344, p=0.0000, cohens_dz=0.928

- ood_prior: muzero vs pomcp: ΔSR=0.371, p=0.0000, cohens_dz=1.167

- ood_reverb: muzero vs sequential: ΔSR=-0.215, p=0.0000, cohens_dz=-0.557

- ood_reverb: muzero vs ppo: ΔSR=0.367, p=0.0000, cohens_dz=1.016

- ood_reverb: muzero vs ppo_stack: ΔSR=0.310, p=0.0000, cohens_dz=0.847

- ood_snr: muzero vs sequential: ΔSR=-0.236, p=0.0000, cohens_dz=-0.782

- ood_snr: muzero vs dqn: ΔSR=0.384, p=0.0000, cohens_dz=1.223

- ood_snr: muzero vs ppo: ΔSR=0.423, p=0.0000, cohens_dz=1.184

- ood_snr: muzero vs ppo_stack: ΔSR=0.380, p=0.0000, cohens_dz=1.044

- ood_snr: muzero vs pomcp: ΔSR=-0.242, p=0.0000, cohens_dz=-0.903

- adversarial: muzero vs ppo_stack: ΔSR=0.349, p=0.0000, cohens_dz=0.971

- biased: muzero vs ppo_stack: ΔSR=0.349, p=0.0000, cohens_dz=0.971

- correct: muzero vs belief_greedy: ΔSR=-0.279, p=0.0000, cohens_dz=-0.893

- correct: muzero vs ppo_stack: ΔSR=0.349, p=0.0000, cohens_dz=0.971

- uniform: muzero vs belief_greedy: ΔSR=-0.164, p=0.0000, cohens_dz=-0.394

- uniform: muzero vs ppo_stack: ΔSR=0.349, p=0.0000, cohens_dz=0.971

- pfa_0.01: muzero vs dqn_gru: ΔSR=0.230, p=0.0000, cohens_dz=0.593

- pfa_0.01: muzero vs ppo_stack: ΔSR=0.360, p=0.0000, cohens_dz=0.991

- pfa_0.03: muzero vs ppo_stack: ΔSR=0.325, p=0.0000, cohens_dz=0.878

- pfa_0.05: muzero vs belief_greedy: ΔSR=-0.293, p=0.0000, cohens_dz=-0.971

- pfa_0.05: muzero vs ppo_stack: ΔSR=0.357, p=0.0000, cohens_dz=0.997

- pfa_0.08: muzero vs ppo_stack: ΔSR=0.294, p=0.0000, cohens_dz=0.801

- pfa_0.10: muzero vs belief_greedy: ΔSR=-0.293, p=0.0000, cohens_dz=-0.906

- pfa_0.10: muzero vs ppo_stack: ΔSR=0.297, p=0.0000, cohens_dz=0.821

- pfa_0.12: muzero vs belief_greedy: ΔSR=-0.306, p=0.0000, cohens_dz=-1.002

- pfa_0.12: muzero vs dqn_gru: ΔSR=0.207, p=0.0000, cohens_dz=0.541

- snr_+0dB: muzero vs belief_greedy: ΔSR=-0.270, p=0.0000, cohens_dz=-0.839

- snr_+0dB: muzero vs dqn_gru: ΔSR=0.242, p=0.0000, cohens_dz=0.628

- snr_+0dB: muzero vs ppo_stack: ΔSR=0.356, p=0.0000, cohens_dz=0.964

- snr_+10dB: muzero vs belief_greedy: ΔSR=-0.266, p=0.0000, cohens_dz=-1.058

- snr_+10dB: muzero vs dqn_gru: ΔSR=0.242, p=0.0000, cohens_dz=0.635

- snr_+3dB: muzero vs belief_greedy: ΔSR=-0.284, p=0.0000, cohens_dz=-0.977

- snr_+3dB: muzero vs ppo_stack: ΔSR=0.370, p=0.0000, cohens_dz=1.068

- snr_+6dB: muzero vs belief_greedy: ΔSR=-0.274, p=0.0000, cohens_dz=-1.061

- snr_-3dB: muzero vs ppo_stack: ΔSR=0.299, p=0.0000, cohens_dz=0.829

- snr_-6dB: muzero vs belief_greedy: ΔSR=-0.321, p=0.0000, cohens_dz=-0.805

- snr_-6dB: muzero vs dqn_gru: ΔSR=0.163, p=0.0000, cohens_dz=0.433

- snr_-6dB: muzero vs ppo_stack: ΔSR=0.216, p=0.0000, cohens_dz=0.597